{
  "$schema": "https://json-schema.org/draft/2020-12/schema",
  "$id": "https://westkitty.github.io/Starsilk_Character_Dossier/machine/schema/v1/context-packet.schema.json",
  "title": "Starsilk AI context packet v1",
  "type": "object",
  "additionalProperties": false,
  "required": ["schema", "schema_url", "project_id", "packet_kind", "packet_url", "stable_id", "display_label", "canonical_url", "legacy_url", "result_class", "navigation_group", "archetype", "excerpt", "excerpt_source_ref", "visibility", "canon_status", "spoiler_level", "related_media_ids", "observed_relationships", "source_refs", "source_claims", "unknowns", "authority_note"],
  "properties": {
    "schema": {"const": "starsilk-ai-context-packet/1"}, "schema_url": {"type": "string", "format": "uri"}, "project_id": {"const": "starsilk-character-dossier"}, "packet_kind": {"const": "entity-context"}, "packet_url": {"type": "string", "format": "uri"}, "stable_id": {"type": "string", "minLength": 1}, "display_label": {"type": "string", "minLength": 1}, "canonical_url": {"type": "string", "format": "uri"}, "legacy_url": {"type": "string", "format": "uri"}, "result_class": {"type": "string", "minLength": 1}, "navigation_group": {"type": ["string", "null"]}, "archetype": {"type": ["string", "null"]}, "excerpt": {"type": "string"}, "excerpt_source_ref": {"type": "string", "minLength": 1}, "visibility": {"enum": ["public", "private"]}, "canon_status": {"enum": ["canon", "development", "historical", "speculative", "unknown"]}, "spoiler_level": {"enum": ["none", "minor", "major"]}, "related_media_ids": {"type": "array", "uniqueItems": true, "items": {"type": "string", "minLength": 1}},
    "observed_relationships": {"type": "object", "additionalProperties": false, "required": ["kind", "evidence_class", "outgoing_stable_ids", "incoming_stable_ids"], "properties": {"kind": {"const": "mentions"}, "evidence_class": {"const": "observed-xref"}, "outgoing_stable_ids": {"type": "array", "uniqueItems": true, "items": {"type": "string", "minLength": 1}}, "incoming_stable_ids": {"type": "array", "uniqueItems": true, "items": {"type": "string", "minLength": 1}}}},
    "source_refs": {"type": "array", "minItems": 1, "items": {"type": "object", "additionalProperties": false, "required": ["path", "kind"], "properties": {"path": {"type": "string", "minLength": 1}, "kind": {"type": "string", "minLength": 1}, "anchor": {"type": "string", "minLength": 1}}}},
    "source_claims": {"type": "array", "items": {"type": "object", "additionalProperties": false, "required": ["claim_id", "order", "domain", "tag", "label", "statement", "source_ref", "source_locator", "authority", "evidence_class"], "properties": {"claim_id": {"type": "string", "pattern": "^C[0-9]{3}$"}, "order": {"type": "integer", "minimum": 1}, "domain": {"type": "string"}, "tag": {"type": "string"}, "label": {"type": "string", "minLength": 1}, "statement": {"type": "string", "minLength": 1}, "source_ref": {"type": "string", "minLength": 1}, "source_locator": {"type": "string", "minLength": 1}, "authority": {"const": "authored-source"}, "evidence_class": {"const": "authored-lore-record"}}}},
    "unknowns": {"type": "array", "uniqueItems": true, "items": {"type": "string", "minLength": 1}}, "authority_note": {"type": "string", "minLength": 1}
  }
}
