{
  "archetype": "glitch-touched",
  "authority_note": "Compact generated convenience packet. Canon/content authority remains the cited authored source; source_claims are proof-carrying projections of authored Canon Ledger records and are not exhaustive canon; observed relationships prove mentions only; generated excerpts are mechanical source projections, not new canon prose.",
  "canon_status": "unknown",
  "canonical_url": "https://westkitty.github.io/Starsilk_Character_Dossier/entities/drk-viral-bastion/",
  "display_label": "Viral Bastion",
  "excerpt": "Operational role Siege.tmp entity; walking fortress that creates self-defending corrupted-code strongholds and may become a city. Archetype function Unstable anomaly forms built from broken code, paradox, recursion, anti-macro infection and conceptual failure. Visual reference Viral Bastion — archival plate Verified…",
  "excerpt_source_ref": "src/content/sections/drk-viral-bastion.body.html",
  "legacy_url": "https://westkitty.github.io/Starsilk_Character_Dossier/#drk-viral-bastion",
  "navigation_group": "Drakken",
  "observed_relationships": {
    "evidence_class": "observed-xref",
    "incoming_stable_ids": [],
    "kind": "mentions",
    "outgoing_stable_ids": []
  },
  "packet_kind": "entity-context",
  "packet_url": "https://westkitty.github.io/Starsilk_Character_Dossier/discover/packets/drk-viral-bastion.json",
  "project_id": "starsilk-character-dossier",
  "related_media_ids": [
    "215b472c945b203880ff9ff0.webp"
  ],
  "result_class": "character-section",
  "schema": "starsilk-ai-context-packet/1",
  "schema_url": "https://westkitty.github.io/Starsilk_Character_Dossier/machine/schema/v1/context-packet.schema.json",
  "source_claims": [],
  "source_refs": [
    {
      "anchor": "drk-viral-bastion",
      "kind": "authoritative-content",
      "path": "src/content/sections.json"
    },
    {
      "kind": "authoritative-content",
      "path": "src/content/sections/drk-viral-bastion.body.html"
    },
    {
      "kind": "authoritative-content",
      "path": "src/content/sections/drk-viral-bastion.title.html"
    }
  ],
  "spoiler_level": "major",
  "stable_id": "drk-viral-bastion",
  "unknowns": [
    "Per-section canon status is not authored by the current source model.",
    "Per-section spoiler classification is not authored; major is a conservative publication default.",
    "object_type describes the published section structure and is not an ontological claim about the subject."
  ],
  "visibility": "public"
}
