{
  "archetype": null,
  "authority_note": "Compact generated convenience packet. Canon/content authority remains the cited authored source; source_claims are proof-carrying projections of authored Canon Ledger records and are not exhaustive canon; observed relationships prove mentions only; generated excerpts are mechanical source projections, not new canon prose.",
  "canon_status": "unknown",
  "canonical_url": "https://westkitty.github.io/Starsilk_Character_Dossier/entities/rhys/",
  "display_label": "Rhys",
  "excerpt": "Canonical record Lyra ’s brother. Grows fungi on Kepler-186f and lives happily within the existing system. His life operates as a concrete counterweight to arguments that present the present universe only as a structure to be discarded. Registry state Domain Heliocide debate Record Current-message canon Identity Rhys…",
  "excerpt_source_ref": "src/content/sections/rhys.body.html",
  "legacy_url": "https://westkitty.github.io/Starsilk_Character_Dossier/#rhys",
  "navigation_group": null,
  "observed_relationships": {
    "evidence_class": "observed-xref",
    "incoming_stable_ids": [
      "lyra"
    ],
    "kind": "mentions",
    "outgoing_stable_ids": [
      "lyra"
    ]
  },
  "packet_kind": "entity-context",
  "packet_url": "https://westkitty.github.io/Starsilk_Character_Dossier/discover/packets/rhys.json",
  "project_id": "starsilk-character-dossier",
  "related_media_ids": [],
  "result_class": "character-section",
  "schema": "starsilk-ai-context-packet/1",
  "schema_url": "https://westkitty.github.io/Starsilk_Character_Dossier/machine/schema/v1/context-packet.schema.json",
  "source_claims": [],
  "source_refs": [
    {
      "anchor": "rhys",
      "kind": "authoritative-content",
      "path": "src/content/sections.json"
    },
    {
      "kind": "authoritative-content",
      "path": "src/content/sections/rhys.body.html"
    },
    {
      "kind": "authoritative-content",
      "path": "src/content/sections/rhys.title.html"
    }
  ],
  "spoiler_level": "major",
  "stable_id": "rhys",
  "unknowns": [
    "Per-section canon status is not authored by the current source model.",
    "Per-section spoiler classification is not authored; major is a conservative publication default.",
    "object_type describes the published section structure and is not an ontological claim about the subject.",
    "This stable record is not assigned to an authored src/content/nav.json navigation group."
  ],
  "visibility": "public"
}
