{
  "archetype": null,
  "authority_note": "Compact generated convenience packet. Canon/content authority remains the cited authored source; source_claims are proof-carrying projections of authored Canon Ledger records and are not exhaustive canon; observed relationships prove mentions only; generated excerpts are mechanical source projections, not new canon prose.",
  "canon_status": "unknown",
  "canonical_url": "https://westkitty.github.io/Starsilk_Character_Dossier/entities/jalen/",
  "display_label": "Jalen",
  "excerpt": "Canonical record Violently trapped in the antenna grid. Paired with Safi as a fixed structural waypoint in the Orbital Tomb. His final location is made navigationally persistent rather than allowed to become ordinary wreckage. Registry state Domain Meridian Station / Orbital Tomb Record Current-message canon Identity…",
  "excerpt_source_ref": "src/content/sections/jalen.body.html",
  "legacy_url": "https://westkitty.github.io/Starsilk_Character_Dossier/#jalen",
  "navigation_group": null,
  "observed_relationships": {
    "evidence_class": "observed-xref",
    "incoming_stable_ids": [
      "media-vault",
      "safi"
    ],
    "kind": "mentions",
    "outgoing_stable_ids": [
      "safi"
    ]
  },
  "packet_kind": "entity-context",
  "packet_url": "https://westkitty.github.io/Starsilk_Character_Dossier/discover/packets/jalen.json",
  "project_id": "starsilk-character-dossier",
  "related_media_ids": [],
  "result_class": "character-section",
  "schema": "starsilk-ai-context-packet/1",
  "schema_url": "https://westkitty.github.io/Starsilk_Character_Dossier/machine/schema/v1/context-packet.schema.json",
  "source_claims": [],
  "source_refs": [
    {
      "anchor": "jalen",
      "kind": "authoritative-content",
      "path": "src/content/sections.json"
    },
    {
      "kind": "authoritative-content",
      "path": "src/content/sections/jalen.body.html"
    },
    {
      "kind": "authoritative-content",
      "path": "src/content/sections/jalen.title.html"
    }
  ],
  "spoiler_level": "major",
  "stable_id": "jalen",
  "unknowns": [
    "Per-section canon status is not authored by the current source model.",
    "Per-section spoiler classification is not authored; major is a conservative publication default.",
    "object_type describes the published section structure and is not an ontological claim about the subject.",
    "This stable record is not assigned to an authored src/content/nav.json navigation group."
  ],
  "visibility": "public"
}
