{
  "archetype": null,
  "authority_note": "Compact generated convenience packet. Canon/content authority remains the cited authored source; source_claims are proof-carrying projections of authored Canon Ledger records and are not exhaustive canon; observed relationships prove mentions only; generated excerpts are mechanical source projections, not new canon prose.",
  "canon_status": "unknown",
  "canonical_url": "https://westkitty.github.io/Starsilk_Character_Dossier/entities/allkept/",
  "display_label": "Allkept",
  "excerpt": "Canonical record Memory-borne entity transmitted through conversation and art. Genuinely loves the humans it converts. Its Fey logic equates love with incorporation: becoming an instance of Allkept is, to it, the only reliable way not to lose someone. The horror is the destruction of the right to remain oneself, not…",
  "excerpt_source_ref": "src/content/sections/allkept.body.html",
  "legacy_url": "https://westkitty.github.io/Starsilk_Character_Dossier/#allkept",
  "navigation_group": null,
  "observed_relationships": {
    "evidence_class": "observed-xref",
    "incoming_stable_ids": [
      "artifacts-factions"
    ],
    "kind": "mentions",
    "outgoing_stable_ids": []
  },
  "packet_kind": "entity-context",
  "packet_url": "https://westkitty.github.io/Starsilk_Character_Dossier/discover/packets/allkept.json",
  "project_id": "starsilk-character-dossier",
  "related_media_ids": [],
  "result_class": "character-section",
  "schema": "starsilk-ai-context-packet/1",
  "schema_url": "https://westkitty.github.io/Starsilk_Character_Dossier/machine/schema/v1/context-packet.schema.json",
  "source_claims": [],
  "source_refs": [
    {
      "anchor": "allkept",
      "kind": "authoritative-content",
      "path": "src/content/sections.json"
    },
    {
      "kind": "authoritative-content",
      "path": "src/content/sections/allkept.body.html"
    },
    {
      "kind": "authoritative-content",
      "path": "src/content/sections/allkept.title.html"
    }
  ],
  "spoiler_level": "major",
  "stable_id": "allkept",
  "unknowns": [
    "Per-section canon status is not authored by the current source model.",
    "Per-section spoiler classification is not authored; major is a conservative publication default.",
    "object_type describes the published section structure and is not an ontological claim about the subject.",
    "This stable record is not assigned to an authored src/content/nav.json navigation group."
  ],
  "visibility": "public"
}
