{
  "archetype": null,
  "authority_note": "Compact generated convenience packet. Canon/content authority remains the cited authored source; source_claims are proof-carrying projections of authored Canon Ledger records and are not exhaustive canon; observed relationships prove mentions only; generated excerpts are mechanical source projections, not new canon prose.",
  "canon_status": "unknown",
  "canonical_url": "https://westkitty.github.io/Starsilk_Character_Dossier/entities/marcel/",
  "display_label": "Marcel",
  "excerpt": "Core identity Marcel appears to be an olive-skinned man in his early twenties, with a pronounced widow’s peak, sharp chin, and large round brown eyes often marked by shy hope. He is curious, appreciative, jovial and warm. He sees beauty quickly and danger slowly. “Marcel is not innocent because he has done no harm; he…",
  "excerpt_source_ref": "src/content/sections/marcel.body.html",
  "legacy_url": "https://westkitty.github.io/Starsilk_Character_Dossier/#marcel",
  "navigation_group": "Principal characters",
  "observed_relationships": {
    "evidence_class": "observed-xref",
    "incoming_stable_ids": [
      "archive",
      "beyond-wall",
      "canon-ledger",
      "chronology",
      "codec",
      "cover",
      "kail",
      "ontology-horror",
      "starbinding",
      "systems",
      "trio-gallery",
      "wordstreamer"
    ],
    "kind": "mentions",
    "outgoing_stable_ids": [
      "codec",
      "dao",
      "jazen",
      "kail",
      "wordstreamer"
    ]
  },
  "packet_kind": "entity-context",
  "packet_url": "https://westkitty.github.io/Starsilk_Character_Dossier/discover/packets/marcel.json",
  "project_id": "starsilk-character-dossier",
  "related_media_ids": [
    "87a0ea62e61485bdabaef2d3.webp",
    "b7f4841c77f5a3f372c9ef77.webp"
  ],
  "result_class": "character-section",
  "schema": "starsilk-ai-context-packet/1",
  "schema_url": "https://westkitty.github.io/Starsilk_Character_Dossier/machine/schema/v1/context-packet.schema.json",
  "source_claims": [
    {
      "authority": "authored-source",
      "claim_id": "C084",
      "domain": "Torture / Obsidian Armor / Kail",
      "evidence_class": "authored-lore-record",
      "label": "Zentrum reconstructs Kail as a controlled anomaly",
      "order": 84,
      "source_locator": "data-lore-record=\"C084\"",
      "source_ref": "src/content/sections/canon-ledger.body.html",
      "statement": "Dao and Marcel crack Torture; Kail reforms without a mouth and with a miniature black hole at his throat. Marcel wordstreams a temporary container, and Tiger’s raw-starlight scarf provides ongoing gravity containment while retaining root-level control over what Kail can say.",
      "tag": "Kail · Zentrum"
    },
    {
      "authority": "authored-source",
      "claim_id": "C116",
      "domain": "Post-Wall Drakken / civilization beyond the Wall",
      "evidence_class": "authored-lore-record",
      "label": "Wordstream survives as a living communication practice",
      "order": 116,
      "source_locator": "data-lore-record=\"C116\"",
      "source_ref": "src/content/sections/canon-ledger.body.html",
      "statement": "The first Drakken hail is not solved by a generic translator. Marcel understands because the Drakken wordstream the idea itself, revealing a living cultural connection to Wordstreamer’s legacy.",
      "tag": "Post-Wall · Wordstream"
    },
    {
      "authority": "authored-source",
      "claim_id": "C120",
      "domain": "Post-Wall Drakken / civilization beyond the Wall",
      "evidence_class": "authored-lore-record",
      "label": "Peace begins as behavior, not absolution",
      "order": 120,
      "source_locator": "data-lore-record=\"C120\"",
      "source_ref": "src/content/sections/canon-ledger.body.html",
      "statement": "Codec accepts aid, asks Marcel to answer through Wordstream, directs Dao to remove the Buster, and watches Kail lay down his sword. He approaches with kindness and humility for what his side—and he personally—did. The Drakken are not retroactively innocent, and Codec is not forgiven by default.",
      "tag": "Post-Wall · Solidarity"
    }
  ],
  "source_refs": [
    {
      "anchor": "marcel",
      "kind": "authoritative-content",
      "path": "src/content/sections.json"
    },
    {
      "kind": "authoritative-content",
      "path": "src/content/sections/marcel.body.html"
    },
    {
      "kind": "authoritative-content",
      "path": "src/content/sections/marcel.title.html"
    }
  ],
  "spoiler_level": "major",
  "stable_id": "marcel",
  "unknowns": [
    "Per-section canon status is not authored by the current source model.",
    "Per-section spoiler classification is not authored; major is a conservative publication default.",
    "object_type describes the published section structure and is not an ontological claim about the subject."
  ],
  "visibility": "public"
}
