{
  "archetype": "orbital-wyrm",
  "authority_note": "Compact generated convenience packet. Canon/content authority remains the cited authored source; source_claims are proof-carrying projections of authored Canon Ledger records and are not exhaustive canon; observed relationships prove mentions only; generated excerpts are mechanical source projections, not new canon prose.",
  "canon_status": "unknown",
  "canonical_url": "https://westkitty.github.io/Starsilk_Character_Dossier/entities/drk-umbrakrael/",
  "display_label": "Umbrakrael",
  "excerpt": "Operational role Phantom occluder; subtracts visibility and hides fleets or systems. Archetype function Stellar, gravitational, orbital and void-scale operations. Archival visual references Umbrakrael — archival plate Verified archival plate imported from the Drakken art archive. Umbrakrael — secondary reference…",
  "excerpt_source_ref": "src/content/sections/drk-umbrakrael.body.html",
  "legacy_url": "https://westkitty.github.io/Starsilk_Character_Dossier/#drk-umbrakrael",
  "navigation_group": "Drakken",
  "observed_relationships": {
    "evidence_class": "observed-xref",
    "incoming_stable_ids": [
      "media-vault"
    ],
    "kind": "mentions",
    "outgoing_stable_ids": []
  },
  "packet_kind": "entity-context",
  "packet_url": "https://westkitty.github.io/Starsilk_Character_Dossier/discover/packets/drk-umbrakrael.json",
  "project_id": "starsilk-character-dossier",
  "related_media_ids": [
    "9075e7c96ba558dbf2a0f6b6.webp"
  ],
  "result_class": "character-section",
  "schema": "starsilk-ai-context-packet/1",
  "schema_url": "https://westkitty.github.io/Starsilk_Character_Dossier/machine/schema/v1/context-packet.schema.json",
  "source_claims": [],
  "source_refs": [
    {
      "anchor": "drk-umbrakrael",
      "kind": "authoritative-content",
      "path": "src/content/sections.json"
    },
    {
      "kind": "authoritative-content",
      "path": "src/content/sections/drk-umbrakrael.body.html"
    },
    {
      "kind": "authoritative-content",
      "path": "src/content/sections/drk-umbrakrael.title.html"
    }
  ],
  "spoiler_level": "major",
  "stable_id": "drk-umbrakrael",
  "unknowns": [
    "Per-section canon status is not authored by the current source model.",
    "Per-section spoiler classification is not authored; major is a conservative publication default.",
    "object_type describes the published section structure and is not an ontological claim about the subject."
  ],
  "visibility": "public"
}
