{
  "archetype": "seedcarrier",
  "authority_note": "Compact generated convenience packet. Canon/content authority remains the cited authored source; source_claims are proof-carrying projections of authored Canon Ledger records and are not exhaustive canon; observed relationships prove mentions only; generated excerpts are mechanical source projections, not new canon prose.",
  "canon_status": "unknown",
  "canonical_url": "https://westkitty.github.io/Starsilk_Character_Dossier/entities/drk-raintaster/",
  "display_label": "Raintaster",
  "excerpt": "Operational role Precipitation synth; customizes rainfall for nutrient delivery, biowarfare or biome unlocking. Archetype function Replacement ecology: megaflora, spores, fungi, rain, soil, biomes and mutation. Visual reference Raintaster — archival plate Verified archival plate imported from the Drakken art archive.…",
  "excerpt_source_ref": "src/content/sections/drk-raintaster.body.html",
  "legacy_url": "https://westkitty.github.io/Starsilk_Character_Dossier/#drk-raintaster",
  "navigation_group": "Drakken",
  "observed_relationships": {
    "evidence_class": "observed-xref",
    "incoming_stable_ids": [
      "media-vault"
    ],
    "kind": "mentions",
    "outgoing_stable_ids": []
  },
  "packet_kind": "entity-context",
  "packet_url": "https://westkitty.github.io/Starsilk_Character_Dossier/discover/packets/drk-raintaster.json",
  "project_id": "starsilk-character-dossier",
  "related_media_ids": [
    "58783ecbc00bea4564aa497e.webp"
  ],
  "result_class": "character-section",
  "schema": "starsilk-ai-context-packet/1",
  "schema_url": "https://westkitty.github.io/Starsilk_Character_Dossier/machine/schema/v1/context-packet.schema.json",
  "source_claims": [],
  "source_refs": [
    {
      "anchor": "drk-raintaster",
      "kind": "authoritative-content",
      "path": "src/content/sections.json"
    },
    {
      "kind": "authoritative-content",
      "path": "src/content/sections/drk-raintaster.body.html"
    },
    {
      "kind": "authoritative-content",
      "path": "src/content/sections/drk-raintaster.title.html"
    }
  ],
  "spoiler_level": "major",
  "stable_id": "drk-raintaster",
  "unknowns": [
    "Per-section canon status is not authored by the current source model.",
    "Per-section spoiler classification is not authored; major is a conservative publication default.",
    "object_type describes the published section structure and is not an ontological claim about the subject."
  ],
  "visibility": "public"
}
